{
  "id": "ctx-dk-language-reality",
  "appliesTo": {
    "kind": "destination",
    "id": "dk"
  },
  "topic": "Denmark is less English-taught than it looks",
  "text": "Denmark has a reputation for English-language higher education, and at master's level that reputation is earned. At bachelor's level it is not. The University of Copenhagen — the country's largest and best known university — teaches all 78 of its bachelor programmes in Danish, and most Danish bachelor's degrees are the same. The English-taught bachelor's offering is real, and it is a specific and fairly narrow set of programmes rather than a choice you can make freely across the country. That is why this site lists the ones it does and not more: the list is short because the reality is.",
  "attribution": "The University of Copenhagen's own bachelor pages, read September 2026",
  "confidence": "widely-reported",
  "appliesToIntake": "2027-autumn",
  "whatThisIsNot": "This is not a rule about you. If you have Danish at A level, or take Studieprøven, the Danish-taught programmes are open to you and the choice becomes much wider.",
  "evidence": [
    "ev-ku-dk-16kiqjk"
  ],
  "meta": {
    "schemaVersion": "1.0",
    "dataAsOf": "2026-09-22"
  }
}
