{
  "id": "ctx-gb-conditional-offers",
  "appliesTo": {
    "kind": "destination",
    "id": "gb"
  },
  "topic": "The one system that expects you not to have your results",
  "text": "Everywhere else in Europe, IB results arriving on 6 July is a problem to be worked around — with a results service, a documentation deadline months earlier, or a decision made on something other than results. The UK simply assumes it. Universities make conditional offers in IB points, you accept one firmly and one as insurance, and in July the offers resolve against the results.\n\nFor an IB student this is a genuine structural advantage and it is worth naming, because the UK is usually discussed in terms of cost. The trade is real: the process fits the qualification, and since Brexit the price for an EU citizen is the international one.",
  "attribution": "UCAS’s published cycle and its description of firm and insurance choices",
  "confidence": "widely-reported",
  "appliesToIntake": "2027-autumn",
  "evidence": [
    "ev-ucas-dates-2027"
  ],
  "meta": {
    "schemaVersion": "1.0",
    "dataAsOf": "2026-09-22"
  }
}
